smartctl 7.3 2022-02-28 r5338 [x86_64-linux-5.15.0-1-generic] (local build)
Copyright (C) 2002-22, Bruce Allen, Christian Franke, www.smartmontools.org

=== START OF SMART DATA SECTION ===
SMART overall-health self-assessment test result: PASSED

SMART/Health Information (NVMe Log 0x02)
Critical Warning:                   0x00
Temperature:                        38 Celsius
Available Spare:                    100%
Available Spare Threshold:          10%
Percentage Used:                    3%
Data Units Read:                    1,234,567 [632 GB]
Data Units Written:                 234,567 [120 GB]
Host Read Commands:                 12,345,678
Host Write Commands:                2,345,678
Media and Data Integrity Errors:    0
Error Information Log Entries:      0
